{
  "schema": "ld-s10y-image/figure-spec@2",
  "id": "fig-25",
  "mode": "deterministic",
  "description": "Original PNG: base OY, arcs centered at O/Y intersect at X, both triangle sides connect that intersection. Current lesson lengths OY=4, OX=3.5, YX=3; unequal sides are not replaced by symmetric equal sides.",
  "source": {
    "image": {
      "path": "ssot-resources/soviet10year-textbooks/artifacts/5m/figures/fig-25.png",
      "sha256": "d9646541b5977d70967852af1b9b1e37d75cf82c76423a2d5a59e56ebb9cd898"
    },
    "authoritativeText": [
      {
        "lesson": "math5-c1-s1-n7",
        "text": "问题. 用直尺和圆规作 $\\triangle XOY$，使 $|XO|=3.5$ 厘米， $|OY|=4$ 厘米， $|YX|=3$ 厘米.\n\n假如用活动接头把三根各长 3 厘米、3.5 厘米和 4 厘米的木条连接起来，如图 24 所示，转动两边的两根木条，可以构成一个三角形. 可以用圆规来代替旋转木条.\n\n首先作长 4 厘米的线段 $OY$（图 25）. 然后划两个圆弧：一个弧的圆心为 $O$，半径长 3.5 厘米，另一个弧的圆心为 $Y$，半径长 3 厘米. 交点 $X$ 是三角形的第三顶点. 联结 $X$ 和 $O$、$Y$，即得 $\\triangle XOY$.\n\n假如按图 26 所示联结三根木条，那么只要木条不伸长，不缩短，不弯曲，三角形的形状就不能改变. 所以说三角形是稳定的图形. 在实践中常常用到三角形的这个特性（图 27）.\n\n作三角形用的线段的长度不能随意给定. 在图 28 中，两根短木条的长度的和小于长木条的长度. 因而当围绕 $A$ 点和 $B$ 点转动两根短木条时，两个端点 $C$、$D$ 任何时候都不能重合，结果也就作不成三角形. 总之，如果大边的长度小于其它两边长度的和，就可以按给定的三边作出三角形."
      }
    ],
    "inventory": [
      {
        "id": "SSS-construction",
        "description": "Original PNG: base OY, arcs centered at O/Y intersect at X, both triangle sides connect that intersection. Current lesson lengths OY=4, OX=3.5, YX=3; unequal sides are not replaced by symmetric equal sides.",
        "objects": [
          "OY",
          "OX",
          "YX",
          "O-radius",
          "Y-radius",
          "O-label",
          "Y-label",
          "X-label"
        ],
        "assertions": [
          "base-four",
          "left-three-half",
          "right-three"
        ]
      }
    ]
  },
  "canvas": {
    "width": 960,
    "height": 711,
    "boundingBox": [
      -0.7,
      3.5,
      4.7,
      -0.5
    ],
    "background": "paper",
    "keepAspectRatio": true
  },
  "objects": [
    {
      "id": "OY",
      "type": "segment",
      "from": [
        0,
        0
      ],
      "to": [
        4,
        0
      ],
      "stroke": "ink",
      "strokeWidth": 3
    },
    {
      "id": "OX",
      "type": "segment",
      "from": [
        0,
        0
      ],
      "to": [
        2.40625,
        2.5416453209486174
      ],
      "stroke": "ink",
      "strokeWidth": 3
    },
    {
      "id": "YX",
      "type": "segment",
      "from": [
        4,
        0
      ],
      "to": [
        2.40625,
        2.5416453209486174
      ],
      "stroke": "ink",
      "strokeWidth": 3
    },
    {
      "id": "O-radius",
      "type": "arc",
      "center": [
        0,
        0
      ],
      "start": [
        3.03,
        1.7518846994023325
      ],
      "end": [
        1.8,
        3.0016662039607267
      ],
      "stroke": "ink",
      "strokeWidth": 2
    },
    {
      "id": "Y-radius",
      "type": "arc",
      "center": [
        4,
        0
      ],
      "start": [
        3.1,
        2.8618176042508368
      ],
      "end": [
        1.75,
        1.984313483298443
      ],
      "stroke": "ink",
      "strokeWidth": 2
    },
    {
      "id": "O-label",
      "type": "text",
      "at": [
        -0.18,
        -0.18
      ],
      "text": "O",
      "fontSize": 32,
      "labelColor": "ink",
      "labelPlacement": {
        "position": "CENTER"
      }
    },
    {
      "id": "Y-label",
      "type": "text",
      "at": [
        4.18,
        -0.18
      ],
      "text": "Y",
      "fontSize": 32,
      "labelColor": "ink",
      "labelPlacement": {
        "position": "CENTER"
      }
    },
    {
      "id": "X-label",
      "type": "text",
      "at": [
        2.40625,
        2.781645320948617
      ],
      "text": "X",
      "fontSize": 32,
      "labelColor": "ink",
      "labelPlacement": {
        "position": "CENTER"
      }
    }
  ],
  "assertions": [
    {
      "id": "base-four",
      "type": "distance",
      "a": [
        0,
        0
      ],
      "b": [
        4,
        0
      ],
      "tolerance": 1e-10,
      "value": 4
    },
    {
      "id": "left-three-half",
      "type": "distance",
      "a": [
        0,
        0
      ],
      "b": [
        2.40625,
        2.5416453209486174
      ],
      "tolerance": 1e-10,
      "value": 3.5
    },
    {
      "id": "right-three",
      "type": "distance",
      "a": [
        4,
        0
      ],
      "b": [
        2.40625,
        2.5416453209486174
      ],
      "tolerance": 1e-10,
      "value": 3
    }
  ],
  "layout": {
    "minLabelGap": 2,
    "avoidRegions": []
  },
  "display": {
    "layout": "scroll",
    "purpose": "instructional",
    "minTextPx": 16,
    "widths": [
      640
    ]
  }
}
