{
  "schema": "ld-s10y-image/figure-spec@2",
  "id": "fig-20",
  "mode": "deterministic",
  "description": "Original PNG: ABC right triangle with right angle at B, legs AB/BC and hypotenuse AC; 90-degree mark belongs at B, never on base AC. Geometry regularized to exact right angle.",
  "source": {
    "image": {
      "path": "ssot-resources/soviet10year-textbooks/artifacts/5m/figures/fig-20.png",
      "sha256": "99cf158749ac122f220cead649bfbbd20942e97bc4ce6bb9b3a651ea1cd2766e"
    },
    "authoritativeText": [
      {
        "lesson": "math5-c1-s1-n6",
        "text": "三角形可按它的角的大小进行分类. 三角形中至多有一个直角或一个钝角，否则，仅这两个角的和就不小于 $180^\\circ$. 所以各种三角形的集合可以按角的大小分成三类：1) 锐角三角形，三个角都是锐角（图 19）；2) 直角三角形，有一个直角（图 20）；3) 钝角三角形，有一个钝角（图 21）.\n\n直角三角形的三个边有专门的名称，如图 20 所示. 三角形也可以按边长分类. 如果三角形中有两边相等，则把这种三角形叫做等腰三角形. 其余所有三角形（三个边没有等长的）构成由不等边三角形组成的子集. 三角形的集合分为二类：等腰三角形的集合和不等边三角形的集合. 等腰三角形的三个边有专门名称，如图 22 所示. 三边相等的三角形叫做等边三角形. 等边三角形的集合是等腰三角形的集合的子集."
      }
    ],
    "inventory": [
      {
        "id": "right-triangle",
        "description": "Original PNG: ABC right triangle with right angle at B, legs AB/BC and hypotenuse AC; 90-degree mark belongs at B, never on base AC. Geometry regularized to exact right angle.",
        "objects": [
          "right-triangle",
          "right-angle",
          "hypotenuse-label",
          "left-leg-label",
          "right-leg-label",
          "A-label",
          "B-label",
          "C-label",
          "90-label"
        ],
        "assertions": [
          "right-at-B"
        ]
      }
    ]
  },
  "canvas": {
    "width": 960,
    "height": 587,
    "boundingBox": [
      0,
      220,
      360,
      0
    ],
    "background": "paper",
    "keepAspectRatio": true
  },
  "objects": [
    {
      "id": "right-triangle",
      "type": "polygon",
      "points": [
        [
          40,
          40
        ],
        [
          300,
          40
        ],
        [
          220,
          160
        ]
      ],
      "stroke": "ink",
      "strokeWidth": 3,
      "fill": "paper",
      "fillOpacity": 0
    },
    {
      "id": "right-angle",
      "type": "arc",
      "center": [
        220,
        160
      ],
      "start": [
        199.199,
        146.133
      ],
      "end": [
        233.867,
        139.199
      ],
      "stroke": "ink",
      "strokeWidth": 2
    },
    {
      "id": "hypotenuse-label",
      "type": "text",
      "at": [
        170,
        20
      ],
      "text": "Hypotenuse",
      "fontSize": 27,
      "labelColor": "ink",
      "labelPlacement": {
        "position": "CENTER"
      }
    },
    {
      "id": "left-leg-label",
      "type": "text",
      "at": [
        125,
        130
      ],
      "text": "Leg",
      "fontSize": 32,
      "labelColor": "ink",
      "labelPlacement": {
        "position": "CENTER"
      }
    },
    {
      "id": "right-leg-label",
      "type": "text",
      "at": [
        282,
        111
      ],
      "text": "Leg",
      "fontSize": 32,
      "labelColor": "ink",
      "labelPlacement": {
        "position": "CENTER"
      }
    },
    {
      "id": "A-label",
      "type": "text",
      "at": [
        20,
        30
      ],
      "text": "A",
      "fontSize": 32,
      "labelColor": "ink",
      "labelPlacement": {
        "position": "CENTER"
      }
    },
    {
      "id": "B-label",
      "type": "text",
      "at": [
        224,
        178
      ],
      "text": "B",
      "fontSize": 32,
      "labelColor": "ink",
      "labelPlacement": {
        "position": "CENTER"
      }
    },
    {
      "id": "C-label",
      "type": "text",
      "at": [
        318,
        30
      ],
      "text": "C",
      "fontSize": 32,
      "labelColor": "ink",
      "labelPlacement": {
        "position": "CENTER"
      }
    },
    {
      "id": "90-label",
      "type": "text",
      "at": [
        217,
        132
      ],
      "text": "90°",
      "fontSize": 26,
      "labelColor": "ink",
      "labelPlacement": {
        "position": "CENTER"
      }
    }
  ],
  "assertions": [
    {
      "id": "right-at-B",
      "type": "perpendicular",
      "a": [
        220,
        160
      ],
      "b": [
        40,
        40
      ],
      "c": [
        220,
        160
      ],
      "d": [
        300,
        40
      ]
    }
  ],
  "layout": {
    "minLabelGap": 2,
    "avoidRegions": []
  },
  "display": {
    "layout": "scroll",
    "purpose": "instructional",
    "minTextPx": 16,
    "widths": [
      640
    ]
  }
}
