{
  "schema": "ld-s10y-image/figure-spec@2",
  "id": "fig-79",
  "mode": "deterministic",
  "description": "Instructional source figure fig-79: all given data retained, no solution annotations.",
  "source": {
    "image": {
      "path": "ssot-resources/soviet10year-textbooks/artifacts/6a/figures/fig-79.png",
      "sha256": "c1c1aa320305220a96a29b6333446ea9e8d9fcba6aad2fa467ee2a749b61577c"
    },
    "authoritativeText": [
      {
        "lesson": "alg6-c2-s4-n21",
        "text": "式 $y=kx+l$ 给出的函数，它的图象的位置决定于 $k$ 和 $l$的值的大小。\n我们知道，式 $y=kx+l$ 和 $y=kx$ 给出的两个函数，当 $k$取相同的值时，它们的图象是平行的直线。\n由此得出，公式$y=kx+l$ 给出的函数，当 $k$ 取相同的值时，函数的图象是互相平行的直线。\n图 $78$ 上画出的是由下列各式给出的函数的图象：\n$y=1.5x+7,y=1.5x+2,y=1.5x,y=1.5x-3$。\n系数 $k$ 决定线性函数的图象对 $x$ 轴的倾斜角的大小。\n如果 $k$ 是正数，那么倾斜角是锐角（图 $79$a）；\n如果 $k$ 是负数，那么倾斜角是钝角（图 $79$b）。\n\n数 $k$ 叫做直线的斜率。\n式 $y=kx+l$ 给出的线性函数，它的图象的位置和数 $l$ 有什么关系呢？\n如果 $x=0$，那么 $y=l$。\n就是说，线性函数的图象和 $y$ 轴的交点，纵坐标等于 $l$。\n图 $80$ 上画出的是由下列各式给出的函数的图象：\n$y=2x+3,\\ y=0.5x+3,\\ y=-1.5x+3,$ $y=-0.5x+3$。\n这些图象都经过点 $A(0,3)$。"
      }
    ],
    "inventory": [
      {
        "id": "panel-0",
        "description": "Source separate 12 by 12 unit grid, origin and unit labels, one sloped line, inclination arc alpha at its x intercept, sign of k. Exact slope not given; representative sign-preserving geometry.",
        "objects": [
          "p0-grid",
          "p0-x",
          "p0-y",
          "p0-line",
          "p0-k",
          "p0-part",
          "p0-angle",
          "p0-alpha",
          "p0-xname",
          "p0-yname",
          "p0-origin"
        ],
        "assertions": [
          "source-object-count",
          "p0-perpendicular"
        ]
      },
      {
        "id": "panel-1",
        "description": "Source separate 12 by 12 unit grid, origin and unit labels, one sloped line, inclination arc alpha at its x intercept, sign of k. Exact slope not given; representative sign-preserving geometry.",
        "objects": [
          "p1-grid",
          "p1-x",
          "p1-y",
          "p1-line",
          "p1-k",
          "p1-part",
          "p1-angle",
          "p1-alpha",
          "p1-xname",
          "p1-yname",
          "p1-origin"
        ],
        "assertions": [
          "p1-perpendicular"
        ]
      }
    ]
  },
  "canvas": {
    "width": 960,
    "height": 620,
    "boundingBox": [
      -7,
      12,
      21,
      -4
    ],
    "background": "paper",
    "keepAspectRatio": false
  },
  "display": {
    "purpose": "instructional",
    "layout": "scroll",
    "widths": [
      640
    ],
    "minTextPx": 16
  },
  "objects": [
    {
      "id": "p0-grid",
      "type": "grid",
      "bounds": [
        -6,
        10,
        6,
        -2
      ],
      "xStep": 1,
      "yStep": 1,
      "stroke": "grid",
      "strokeWidth": 0.8
    },
    {
      "id": "p0-x",
      "type": "axis",
      "from": [
        -6,
        0
      ],
      "to": [
        6,
        0
      ],
      "ticks": [
        {
          "at": [
            1,
            0
          ],
          "label": "1",
          "fontSize": 28,
          "labelPlacement": {
            "position": "S",
            "gap": 35
          }
        }
      ]
    },
    {
      "id": "p0-y",
      "type": "axis",
      "from": [
        0,
        -2
      ],
      "to": [
        0,
        10
      ],
      "ticks": [
        {
          "at": [
            0,
            1
          ],
          "label": "1",
          "fontSize": 28,
          "labelPlacement": {
            "position": "W",
            "gap": 20
          }
        }
      ]
    },
    {
      "id": "p0-line",
      "type": "segment",
      "from": [
        -6,
        -1.6
      ],
      "to": [
        1.25,
        10
      ],
      "stroke": "ink",
      "strokeWidth": 2.5
    },
    {
      "id": "p0-k",
      "type": "text",
      "at": [
        -3,
        7
      ],
      "text": "k>0",
      "fontSize": 28,
      "labelPlacement": {
        "position": "CENTER",
        "offset": [
          0,
          0
        ],
        "gap": 0
      }
    },
    {
      "id": "p0-part",
      "type": "text",
      "at": [
        0,
        -3
      ],
      "text": "a)",
      "fontSize": 28,
      "labelPlacement": {
        "position": "CENTER",
        "offset": [
          0,
          0
        ],
        "gap": 0
      }
    },
    {
      "id": "p0-angle",
      "type": "arc",
      "center": [
        -5,
        0
      ],
      "start": [
        -3.2,
        0
      ],
      "end": [
        -4.046001907994276,
        1.5263969472091583
      ],
      "stroke": "muted",
      "strokeWidth": 2
    },
    {
      "id": "p0-alpha",
      "type": "text",
      "at": [
        -2.9,
        1.4
      ],
      "text": "alpha",
      "fontSize": 26,
      "labelPlacement": {
        "position": "CENTER",
        "offset": [
          0,
          0
        ],
        "gap": 0
      }
    },
    {
      "id": "p1-grid",
      "type": "grid",
      "bounds": [
        8,
        10,
        20,
        -2
      ],
      "xStep": 1,
      "yStep": 1,
      "stroke": "grid",
      "strokeWidth": 0.8
    },
    {
      "id": "p1-x",
      "type": "axis",
      "from": [
        8,
        0
      ],
      "to": [
        20,
        0
      ],
      "ticks": [
        {
          "at": [
            14,
            0
          ],
          "label": "1",
          "fontSize": 28,
          "labelPlacement": {
            "position": "S",
            "gap": 35
          }
        }
      ]
    },
    {
      "id": "p1-y",
      "type": "axis",
      "from": [
        13,
        -2
      ],
      "to": [
        13,
        10
      ],
      "ticks": [
        {
          "at": [
            13,
            1
          ],
          "label": "1",
          "fontSize": 28,
          "labelPlacement": {
            "position": "W",
            "gap": 20
          }
        }
      ]
    },
    {
      "id": "p1-line",
      "type": "segment",
      "from": [
        8,
        7.2
      ],
      "to": [
        19.5,
        -2
      ],
      "stroke": "ink",
      "strokeWidth": 2.5
    },
    {
      "id": "p1-k",
      "type": "text",
      "at": [
        10,
        7
      ],
      "text": "k<0",
      "fontSize": 28,
      "labelPlacement": {
        "position": "CENTER",
        "offset": [
          0,
          0
        ],
        "gap": 0
      }
    },
    {
      "id": "p1-part",
      "type": "text",
      "at": [
        14,
        -3
      ],
      "text": "b)",
      "fontSize": 28,
      "labelPlacement": {
        "position": "CENTER",
        "offset": [
          0,
          0
        ],
        "gap": 0
      }
    },
    {
      "id": "p1-angle",
      "type": "arc",
      "center": [
        17,
        0
      ],
      "start": [
        18.8,
        0
      ],
      "end": [
        15.594436143002547,
        1.1244510855979641
      ],
      "stroke": "muted",
      "strokeWidth": 2
    },
    {
      "id": "p1-alpha",
      "type": "text",
      "at": [
        19.1,
        1.4
      ],
      "text": "alpha",
      "fontSize": 26,
      "labelPlacement": {
        "position": "CENTER",
        "offset": [
          0,
          0
        ],
        "gap": 0
      }
    },
    {
      "id": "p0-xname",
      "type": "text",
      "at": [
        6.45,
        0
      ],
      "text": "x",
      "fontSize": 28,
      "labelPlacement": {
        "position": "CENTER",
        "offset": [
          0,
          0
        ],
        "gap": 0
      }
    },
    {
      "id": "p0-yname",
      "type": "text",
      "at": [
        0,
        10.9
      ],
      "text": "y",
      "fontSize": 28,
      "labelPlacement": {
        "position": "CENTER",
        "offset": [
          0,
          0
        ],
        "gap": 0
      }
    },
    {
      "id": "p0-origin",
      "type": "text",
      "at": [
        -0.65,
        -0.8
      ],
      "text": "0",
      "fontSize": 26,
      "labelPlacement": {
        "position": "CENTER",
        "offset": [
          0,
          0
        ],
        "gap": 0
      }
    },
    {
      "id": "p1-xname",
      "type": "text",
      "at": [
        20.45,
        0
      ],
      "text": "x",
      "fontSize": 28,
      "labelPlacement": {
        "position": "CENTER",
        "offset": [
          0,
          0
        ],
        "gap": 0
      }
    },
    {
      "id": "p1-yname",
      "type": "text",
      "at": [
        13,
        10.9
      ],
      "text": "y",
      "fontSize": 28,
      "labelPlacement": {
        "position": "CENTER",
        "offset": [
          0,
          0
        ],
        "gap": 0
      }
    },
    {
      "id": "p1-origin",
      "type": "text",
      "at": [
        12.35,
        -0.8
      ],
      "text": "0",
      "fontSize": 26,
      "labelPlacement": {
        "position": "CENTER",
        "offset": [
          0,
          0
        ],
        "gap": 0
      }
    }
  ],
  "assertions": [
    {
      "id": "source-object-count",
      "type": "objectCount",
      "objectType": "grid",
      "count": 2
    },
    {
      "id": "p0-perpendicular",
      "type": "perpendicular",
      "a": [
        -6,
        0
      ],
      "b": [
        6,
        0
      ],
      "c": [
        0,
        -2
      ],
      "d": [
        0,
        10
      ]
    },
    {
      "id": "p1-perpendicular",
      "type": "perpendicular",
      "a": [
        8,
        0
      ],
      "b": [
        20,
        0
      ],
      "c": [
        13,
        -2
      ],
      "d": [
        13,
        10
      ]
    }
  ]
}
