{
  "schema": "ld-s10y-image/figure-spec@2",
  "id": "fig-choice-n20-e310-graph-o2",
  "mode": "deterministic",
  "description": "Exact authored function graph; domain restrictions and endpoint inclusion are explicit.",
  "source": {
    "image": {
      "path": "ssot-resources/soviet10year-textbooks/artifacts/6a/figures/fig-77.png",
      "sha256": "f25bda253f5713bb62ea8239c413b9b42b83c3e22bc0a8ba9788279f9cc2fe0d"
    },
    "authoritativeText": [
      {
        "text": "图 $77$ 上画出的直线是式 $y=-3x$ 给出的函数的图象。相对于这条直线来说，下面式子给出的函数图象的位置怎样呢？\na) $y=-3x+1$；\nb) $y=-3x-4$。"
      },
      {
        "text": "作式 $y=0.8x-4$ 给出的函数的图象。利用所作图象，回答下列问题：\na) 当 $x$ 等于 $5$ 和 $1.5$ 时，函数取什么值？\nb) 当 $x$ 取什么值时，变量 $y$ 的值等于 $4$？\nc) 函数取负值、正值、大于 $4$ 的值时，$x$ 值的集合是什么？\nd) 数区间 $[5,10]$ 被映射到什么集合上？"
      },
      {
        "text": "作式 $y=-1.5x+6$ 给出的函数的图象。利用所作图象，回答下列问题：\na) 当 $x$ 取什么值时，$y$ 等于 $0,-3,3$？\nb) 函数取负值、正值、大于 $3$ 的值时，$x$ 值的集合是什么？\nc) 数区间 $]0,3]$ 被映射到什么集合上？"
      },
      {
        "text": "作式 $y=x-3$ 给出的函数的图象。利用图象求 $x$ 值的集合，已知式 $x-3$ 的值：\na) 等于 $4$；\nb) 等于 $-2$；\nc) 大于 $4$；\nd) 小于 $5$。"
      },
      {
        "text": "不作图，说明式 $y=1.2x-7$ 给出的函数的图象是否经过下列各点：\na) $A(10,5)$；\nb) $B(15,11)$；\nc) $C(-1.5,-10)$；\nd) $D(-40,-50)$。"
      },
      {
        "text": "作式 $y=2x-5$ 给出的线性函数的图象。利用图象了解$y$ 值的变化情况：\na) $x$ 值由 $-3$ 增大到 $-2$；\nb) $x$ 值由 $1$ 增大到 $2$；\nc) $x$ 值由 $3$ 增大到 $4$；\nd) $x$ 值由 $5$ 增大到 $6$。"
      },
      {
        "text": "式 $y=-2.5x+4$ 给出一线性函数，定义域是 $[-2,5]$。作这个函数的图象并求出它的值域。"
      },
      {
        "text": "式 $y=-3x+9$ 在集合 $\\{x|x\\in Z,\\ 3\\le x\\le7\\}$ 上给出一线性函数。作这个函数的图象并求出它的值域。"
      },
      {
        "text": "一队旅行者经过 $A$ 地后，现在正在离 $A$ 地 $8$ 公里处。如果他们步行的速度是 $4$ 公里/小时，步行 $t\\ (0\\le t\\le4)$ 小时后，他们离 $A$ 地的距离 $s$ 是多少公里？用式表示 $s$ 对$t$ 的依赖关系，并作出运动的图象。根据图象求：\na) 经过 $1.5$ 小时、$2.5$ 小时、$3$ 小时后，旅行者和 $A$ 地的距离是多少公里。\nb) 经过几小时以后，旅行者可以到达离 $A$ 地 $12$ 公里远的 $B$ 地和离 $A$ 地 $20$ 公里远的 $C$ 地？"
      },
      {
        "text": "哪幅图是函数 $y=2x-5$ 的图象？"
      }
    ],
    "inventory": [
      {
        "id": "source-frame-reference",
        "description": "Inspected original fig-77.png: a 12-column by 12-row unit lattice, x/y arrowed axes through origin, labels 0 and 1, and descending line y=-3x. For authored choice graphs only the Cartesian-frame concept is borrowed. Custom bounds, scales, ticks, units, intercepts, restricted domains and sample points are modern additions derived from each full exercise, not claims about the reference pixels.",
        "objects": [
          "grid",
          "x-axis",
          "y-axis",
          "x-label",
          "y-label"
        ],
        "assertions": [
          "perp",
          "grid-size"
        ]
      }
    ]
  },
  "canvas": {
    "width": 400,
    "height": 400,
    "boundingBox": [
      -8.2,
      13,
      11,
      -17
    ],
    "keepAspectRatio": false,
    "background": "paper"
  },
  "display": {
    "layout": "inline",
    "purpose": "instructional",
    "maxWidthPx": 400,
    "minTextPx": 16,
    "widths": [
      240,
      400
    ]
  },
  "objects": [
    {
      "id": "grid",
      "type": "grid",
      "bounds": [
        -4,
        8,
        8,
        -12
      ],
      "xStep": 1,
      "yStep": 1,
      "stroke": "grid",
      "strokeWidth": 1
    },
    {
      "id": "x-axis",
      "type": "axis",
      "from": [
        -4,
        0
      ],
      "to": [
        8,
        0
      ],
      "stroke": "ink",
      "strokeWidth": 1.5
    },
    {
      "id": "y-axis",
      "type": "axis",
      "from": [
        0,
        -12
      ],
      "to": [
        0,
        8
      ],
      "stroke": "ink",
      "strokeWidth": 1.5
    },
    {
      "id": "x-scale",
      "type": "axis",
      "from": [
        -4,
        -12
      ],
      "to": [
        8,
        -12
      ],
      "stroke": "muted",
      "strokeWidth": 1,
      "ticks": [
        {
          "at": [
            -3,
            -12
          ],
          "label": "-3",
          "size": 0.3,
          "fontSize": 27,
          "labelPlacement": {
            "position": "S",
            "offset": [
              0,
              0
            ],
            "gap": 25
          }
        },
        {
          "at": [
            2,
            -12
          ],
          "label": "2",
          "size": 0.3,
          "fontSize": 27,
          "labelPlacement": {
            "position": "S",
            "offset": [
              0,
              0
            ],
            "gap": 25
          }
        },
        {
          "at": [
            6,
            -12
          ],
          "label": "6",
          "size": 0.3,
          "fontSize": 27,
          "labelPlacement": {
            "position": "S",
            "offset": [
              0,
              0
            ],
            "gap": 25
          }
        }
      ]
    },
    {
      "id": "y-scale",
      "type": "axis",
      "from": [
        -4,
        -12
      ],
      "to": [
        -4,
        8
      ],
      "stroke": "muted",
      "strokeWidth": 1,
      "ticks": [
        {
          "at": [
            -4,
            -10
          ],
          "label": "-10",
          "size": 0.18,
          "fontSize": 27,
          "labelPlacement": {
            "position": "W",
            "offset": [
              0,
              0
            ],
            "gap": 25
          }
        },
        {
          "at": [
            -4,
            -5
          ],
          "label": "-5",
          "size": 0.18,
          "fontSize": 27,
          "labelPlacement": {
            "position": "W",
            "offset": [
              0,
              0
            ],
            "gap": 25
          }
        },
        {
          "at": [
            -4,
            5
          ],
          "label": "5",
          "size": 0.18,
          "fontSize": 27,
          "labelPlacement": {
            "position": "W",
            "offset": [
              0,
              0
            ],
            "gap": 25
          }
        }
      ]
    },
    {
      "id": "x-label",
      "type": "text",
      "at": [
        9.68,
        -1.2
      ],
      "text": "x",
      "fontSize": 27,
      "labelPlacement": {
        "position": "CENTER",
        "offset": [
          0,
          0
        ]
      }
    },
    {
      "id": "y-label",
      "type": "text",
      "at": [
        0.78,
        10.8
      ],
      "text": "y",
      "fontSize": 27,
      "labelPlacement": {
        "position": "CENTER",
        "offset": [
          0,
          0
        ]
      }
    },
    {
      "id": "function",
      "type": "segment",
      "from": [
        -4,
        3
      ],
      "to": [
        3.5,
        -12
      ],
      "stroke": "ink",
      "strokeWidth": 3
    }
  ],
  "assertions": [
    {
      "id": "perp",
      "type": "perpendicular",
      "a": [
        -4,
        0
      ],
      "b": [
        8,
        0
      ],
      "c": [
        0,
        -12
      ],
      "d": [
        0,
        8
      ]
    },
    {
      "id": "grid-size",
      "type": "gridDimensions",
      "grid": "grid",
      "columns": 12,
      "rows": 20
    },
    {
      "id": "function-start",
      "type": "pointOnLine",
      "point": [
        -4,
        3
      ],
      "a": [
        0,
        -5
      ],
      "b": [
        1,
        -7
      ]
    },
    {
      "id": "function-end",
      "type": "pointOnLine",
      "point": [
        3.5,
        -12
      ],
      "a": [
        0,
        -5
      ],
      "b": [
        1,
        -7
      ]
    }
  ]
}
