{
  "schema": "ld-s10y-image/figure-spec@2",
  "id": "fig-104",
  "mode": "deterministic",
  "description": "Source figure 104: two original lines, source point A(5,-1), one unit grid.",
  "source": {
    "image": {
      "path": "ssot-resources/soviet10year-textbooks/artifacts/6a/figures/fig-104.png",
      "sha256": "9334b155ee04c20de9e29686b80dbe59be0e8b74d0b07eee9fa73d33f81dac0a"
    },
    "authoritativeText": [
      {
        "lesson": "alg6-c3-s2-n28",
        "text": "作方程（1）和（2）的图象，作出的两条直线相交于点 $A$ $(5,-1)$（图 104）。"
      },
      {
        "lesson": "alg6-c3-s2-n28",
        "text": "Figure 104"
      },
      {
        "lesson": "alg6-c3-s2-n28",
        "text": "图 104"
      }
    ],
    "inventory": [
      {
        "id": "source-frame",
        "description": "Source coordinate grid [-5,9,13,-9]; exact step 1; all axes and printed ticks retained.",
        "objects": [
          "source-frame-grid",
          "source-frame-x",
          "source-frame-y",
          "source-frame-xn",
          "source-frame-yn",
          "source-frame-zero"
        ],
        "assertions": [
          "source-frame-perpendicular"
        ]
      },
      {
        "id": "source-curves",
        "description": "Source figure 104: two original lines, source point A(5,-1), one unit grid.",
        "objects": [
          "first",
          "first-label",
          "second",
          "second-label",
          "A"
        ],
        "assertions": []
      }
    ]
  },
  "canvas": {
    "width": 640,
    "height": 640,
    "boundingBox": [
      -6.6,
      10.6,
      14.6,
      -10.6
    ],
    "background": "paper",
    "keepAspectRatio": false
  },
  "display": {
    "purpose": "instructional",
    "layout": "scroll",
    "widths": [
      640
    ],
    "minTextPx": 16
  },
  "objects": [
    {
      "id": "source-frame-grid",
      "type": "grid",
      "bounds": [
        -5,
        9,
        13,
        -9
      ],
      "xStep": 1,
      "yStep": 1,
      "stroke": "grid",
      "strokeWidth": 0.8
    },
    {
      "id": "source-frame-x",
      "type": "axis",
      "from": [
        -5,
        0
      ],
      "to": [
        13,
        0
      ],
      "stroke": "ink",
      "strokeWidth": 2,
      "ticks": [
        {
          "at": [
            1,
            0
          ],
          "label": "1",
          "fontSize": 18,
          "labelPlacement": {
            "position": "S",
            "gap": 20,
            "fallback": true
          }
        }
      ]
    },
    {
      "id": "source-frame-y",
      "type": "axis",
      "from": [
        0,
        -9
      ],
      "to": [
        0,
        9
      ],
      "stroke": "ink",
      "strokeWidth": 2,
      "ticks": [
        {
          "at": [
            0,
            1
          ],
          "label": "1",
          "fontSize": 18,
          "labelPlacement": {
            "position": "W",
            "gap": 20,
            "fallback": true
          }
        }
      ]
    },
    {
      "id": "source-frame-xn",
      "type": "text",
      "at": [
        12.5,
        -0.6
      ],
      "text": "x",
      "fontSize": 18,
      "stroke": "ink"
    },
    {
      "id": "source-frame-yn",
      "type": "text",
      "at": [
        0.6,
        8.5
      ],
      "text": "y",
      "fontSize": 18,
      "stroke": "ink"
    },
    {
      "id": "source-frame-zero",
      "type": "text",
      "at": [
        -0.5,
        -0.5
      ],
      "text": "0",
      "fontSize": 18,
      "stroke": "ink"
    },
    {
      "id": "first",
      "type": "segment",
      "from": [
        -5,
        5.666666666666667
      ],
      "to": [
        13,
        -6.333333333333333
      ],
      "stroke": "accent",
      "strokeWidth": 2.2
    },
    {
      "id": "first-label",
      "type": "text",
      "at": [
        0.5,
        4.5
      ],
      "text": "2x + 3y = 7",
      "fontSize": 18,
      "stroke": "ink"
    },
    {
      "id": "second",
      "type": "segment",
      "from": [
        13,
        7
      ],
      "to": [
        -3,
        -9
      ],
      "stroke": "ink",
      "strokeWidth": 2.2
    },
    {
      "id": "second-label",
      "type": "text",
      "at": [
        7.7,
        4.5
      ],
      "text": "x - y = 6",
      "fontSize": 18,
      "stroke": "ink"
    },
    {
      "id": "A",
      "type": "point",
      "at": [
        5,
        -1
      ],
      "label": "A (5,-1)",
      "fontSize": 18,
      "stroke": "ink",
      "fill": "ink",
      "labelPlacement": {
        "position": "E",
        "offset": [
          28,
          10
        ]
      }
    }
  ],
  "assertions": [
    {
      "id": "source-frame-perpendicular",
      "type": "perpendicular",
      "a": [
        -5,
        0
      ],
      "b": [
        13,
        0
      ],
      "c": [
        0,
        -9
      ],
      "d": [
        0,
        9
      ]
    },
    {
      "id": "A-first",
      "type": "pointOnLine",
      "point": "A",
      "a": [
        -5,
        5.666666666666667
      ],
      "b": [
        13,
        -6.333333333333333
      ]
    },
    {
      "id": "A-second",
      "type": "pointOnLine",
      "point": "A",
      "a": [
        -5,
        -11
      ],
      "b": [
        13,
        7
      ]
    },
    {
      "id": "count-grid",
      "type": "objectCount",
      "objectType": "grid",
      "count": 1
    },
    {
      "id": "count-axis",
      "type": "objectCount",
      "objectType": "axis",
      "count": 2
    },
    {
      "id": "count-text",
      "type": "objectCount",
      "objectType": "text",
      "count": 5
    },
    {
      "id": "count-segment",
      "type": "objectCount",
      "objectType": "segment",
      "count": 2
    },
    {
      "id": "count-point",
      "type": "objectCount",
      "objectType": "point",
      "count": 1
    }
  ]
}
