{
  "schema": "ld-s10y-image/figure-spec@2",
  "id": "fig-91",
  "mode": "deterministic",
  "description": "Instructional source figure fig-91: all given data retained, no solution annotations.",
  "source": {
    "image": {
      "path": "ssot-resources/soviet10year-textbooks/artifacts/6a/figures/fig-91.png",
      "sha256": "aa8b9f031dcd7bca2bf00c19abb968b1e93eaf8a47d01fe0c8654b923ee4a632"
    },
    "authoritativeText": [
      {
        "lesson": "alg6-c2-ex",
        "exercise": "356",
        "text": "一人步行，一人骑自行车，先后出发从 $A$ 地到 $B$ 地，运动的图象见图 $91$。根据图象求：\na) 步行和自行车的速度（分别求出自行车从 $A$ 到 $B$ 和返程时的速度）。\nb) 骑自行车的人到达 $B$ 地时，步行的人落后多少公里？\nc) 骑自行车的人动身往回走时，步行的人离 $B$ 地还有多远？\nd) 骑自行车的人出发后多少分钟赶上了步行的人？经过多少分钟在往回走的路上又遇到步行的人？两次相遇的过程当中步行的人走了多少公里？\ne) 当骑自行车的人从 $A$ 到 $B$ 和从 $B$ 到 $A$ 的过程中，步行的人分别走了多少公里？\nf) 骑自行车走完全程的时间（包括停留的时间）比步行要少多少时间？"
      }
    ],
    "inventory": [
      {
        "id": "frame",
        "description": "Source grid bounds [0,24,5,0], exact steps 0.3333333333333333,2; ticks x=1,2,3,4, y=4,8,12,16,20,24; axes t (h),s (km).",
        "objects": [
          "grid",
          "x-axis",
          "y-axis",
          "xn",
          "yn",
          "zero"
        ],
        "assertions": [
          "perp"
        ]
      },
      {
        "id": "walk",
        "description": "Independent source graph readings (approximate only where the scan is smooth): [[0,0],[4.8,24]]; preserve endpoints and extrema; no extension.",
        "objects": [
          "walk"
        ],
        "assertions": []
      },
      {
        "id": "cycle",
        "description": "Independent source graph readings (approximate only where the scan is smooth): [[0.6666666666666666,0],[2,24],[2.6666666666666665,24],[4,0]]; preserve endpoints and extrema; no extension.",
        "objects": [
          "cycle"
        ],
        "assertions": []
      }
    ]
  },
  "canvas": {
    "width": 640,
    "height": 620,
    "boundingBox": [
      -0.8,
      27.84,
      5.8,
      -3.84
    ],
    "background": "paper",
    "keepAspectRatio": false
  },
  "display": {
    "purpose": "instructional",
    "layout": "scroll",
    "widths": [
      640
    ],
    "minTextPx": 16
  },
  "objects": [
    {
      "id": "grid",
      "type": "grid",
      "bounds": [
        0,
        24,
        5,
        0
      ],
      "xStep": 0.3333333333333333,
      "yStep": 2,
      "stroke": "grid",
      "strokeWidth": 0.8
    },
    {
      "id": "x-axis",
      "type": "axis",
      "from": [
        0,
        0
      ],
      "to": [
        5,
        0
      ],
      "stroke": "ink",
      "strokeWidth": 2,
      "ticks": [
        {
          "at": [
            1,
            0
          ],
          "label": "1",
          "fontSize": 18,
          "labelPlacement": {
            "position": "S",
            "gap": 7,
            "fallback": true
          }
        },
        {
          "at": [
            2,
            0
          ],
          "label": "2",
          "fontSize": 18,
          "labelPlacement": {
            "position": "S",
            "gap": 7,
            "fallback": true
          }
        },
        {
          "at": [
            3,
            0
          ],
          "label": "3",
          "fontSize": 18,
          "labelPlacement": {
            "position": "S",
            "gap": 7,
            "fallback": true
          }
        },
        {
          "at": [
            4,
            0
          ],
          "label": "4",
          "fontSize": 18,
          "labelPlacement": {
            "position": "S",
            "gap": 7,
            "fallback": true
          }
        }
      ]
    },
    {
      "id": "y-axis",
      "type": "axis",
      "from": [
        0,
        0
      ],
      "to": [
        0,
        24
      ],
      "stroke": "ink",
      "strokeWidth": 2,
      "ticks": [
        {
          "at": [
            0,
            4
          ],
          "label": "4",
          "fontSize": 18,
          "labelPlacement": {
            "position": "W",
            "gap": 7,
            "fallback": true
          }
        },
        {
          "at": [
            0,
            8
          ],
          "label": "8",
          "fontSize": 18,
          "labelPlacement": {
            "position": "W",
            "gap": 7,
            "fallback": true
          }
        },
        {
          "at": [
            0,
            12
          ],
          "label": "12",
          "fontSize": 18,
          "labelPlacement": {
            "position": "W",
            "gap": 7,
            "fallback": true
          }
        },
        {
          "at": [
            0,
            16
          ],
          "label": "16",
          "fontSize": 18,
          "labelPlacement": {
            "position": "W",
            "gap": 7,
            "fallback": true
          }
        },
        {
          "at": [
            0,
            20
          ],
          "label": "20",
          "fontSize": 18,
          "labelPlacement": {
            "position": "W",
            "gap": 7,
            "fallback": true
          }
        },
        {
          "at": [
            0,
            24
          ],
          "label": "24",
          "fontSize": 18,
          "labelPlacement": {
            "position": "W",
            "gap": 7,
            "fallback": true
          }
        }
      ]
    },
    {
      "id": "xn",
      "type": "text",
      "at": [
        5.44,
        0
      ],
      "text": "t (h)",
      "fontSize": 18,
      "labelPlacement": {
        "position": "CENTER",
        "offset": [
          0,
          0
        ],
        "gap": 0
      }
    },
    {
      "id": "yn",
      "type": "text",
      "at": [
        0,
        26.688
      ],
      "text": "s (km)",
      "fontSize": 18,
      "labelPlacement": {
        "position": "CENTER",
        "offset": [
          0,
          0
        ],
        "gap": 0
      }
    },
    {
      "id": "zero",
      "type": "text",
      "at": [
        0,
        0
      ],
      "text": "0",
      "fontSize": 18,
      "labelPlacement": {
        "position": "SW",
        "offset": [
          -12,
          15
        ],
        "gap": 0
      }
    },
    {
      "id": "walk",
      "type": "svgPath",
      "d": "M 0.8 27.84 L 5.6 3.84",
      "stroke": "ink",
      "strokeWidth": 3
    },
    {
      "id": "cycle",
      "type": "svgPath",
      "d": "M 1.4666666666666668 27.84 L 2.8 3.84 L 3.466666666666667 3.84 L 4.8 27.84",
      "stroke": "accent",
      "strokeWidth": 3
    },
    {
      "id": "A",
      "type": "text",
      "at": [
        0,
        0
      ],
      "text": "A",
      "fontSize": 18,
      "labelPlacement": {
        "position": "W",
        "gap": 0,
        "offset": [
          -55,
          0
        ]
      }
    },
    {
      "id": "B",
      "type": "text",
      "at": [
        0,
        24
      ],
      "text": "B",
      "fontSize": 18,
      "labelPlacement": {
        "position": "W",
        "gap": 0,
        "offset": [
          -55,
          0
        ]
      }
    }
  ],
  "assertions": [
    {
      "id": "perp",
      "type": "perpendicular",
      "a": [
        0,
        0
      ],
      "b": [
        5,
        0
      ],
      "c": [
        0,
        0
      ],
      "d": [
        0,
        24
      ]
    }
  ]
}
