{
  "schema": "ld-s10y-image/figure-spec@2",
  "id": "fig-ex-e332-points-a",
  "mode": "deterministic",
  "description": "Exact authored function graph; domain restrictions and endpoint inclusion are explicit.",
  "source": {
    "image": {
      "path": "ssot-resources/soviet10year-textbooks/artifacts/6a/figures/fig-64.png",
      "sha256": "04d35cb75b43b28257f0dba267ac7e1e4af08d5543d0d49d60d2874c39c8470e"
    },
    "authoritativeText": [
      {
        "text": "图64源图参考仅提供带网格的坐标系视觉结构；当前题所需数据由该题完整现代题面决定。"
      },
      {
        "text": "映射 $(x,y)\\mapsto(-x,y)$ 下，点 $A(1,2),B(-5,3),C(0,-7),D(5,0)$ 的像组成哪幅点图？"
      }
    ],
    "inventory": [
      {
        "id": "authored-material",
        "description": "实际查看源图64：同一格纸上两条从O出发的运动线段，A约(4,20)，B约(2,30)，横轴时间小时、纵轴路程公里。当前新增图只借坐标框架，不复刻这两条运动线或其刻度；函数、关系和单位来自各自完整题面。 新增图形全部依据当前完整题面构造；不是源图的重绘。",
        "objects": [
          "grid",
          "x-axis",
          "y-axis",
          "x-scale",
          "y-scale",
          "x-label",
          "y-label",
          "p0",
          "p1",
          "p2",
          "p3"
        ],
        "assertions": [
          "perp",
          "grid-size",
          "points-count"
        ]
      }
    ]
  },
  "canvas": {
    "width": 400,
    "height": 400,
    "boundingBox": [
      -17,
      17.5,
      15,
      -15.5
    ],
    "keepAspectRatio": false,
    "background": "paper"
  },
  "display": {
    "layout": "inline",
    "purpose": "instructional",
    "maxWidthPx": 400,
    "minTextPx": 16,
    "widths": [
      240,
      400
    ]
  },
  "objects": [
    {
      "id": "grid",
      "type": "grid",
      "bounds": [
        -10,
        12,
        10,
        -10
      ],
      "xStep": 2,
      "yStep": 2,
      "stroke": "grid",
      "strokeWidth": 1
    },
    {
      "id": "x-axis",
      "type": "axis",
      "from": [
        -10,
        0
      ],
      "to": [
        10,
        0
      ],
      "stroke": "ink",
      "strokeWidth": 1.5
    },
    {
      "id": "y-axis",
      "type": "axis",
      "from": [
        0,
        -10
      ],
      "to": [
        0,
        12
      ],
      "stroke": "ink",
      "strokeWidth": 1.5
    },
    {
      "id": "x-scale",
      "type": "axis",
      "from": [
        -10,
        -10
      ],
      "to": [
        10,
        -10
      ],
      "stroke": "muted",
      "strokeWidth": 1,
      "ticks": [
        {
          "at": [
            -8,
            -10
          ],
          "label": "-8",
          "size": 0.32999999999999996,
          "fontSize": 27,
          "labelPlacement": {
            "position": "S",
            "offset": [
              0,
              0
            ],
            "gap": 25
          }
        },
        {
          "at": [
            -4,
            -10
          ],
          "label": "-4",
          "size": 0.32999999999999996,
          "fontSize": 27,
          "labelPlacement": {
            "position": "S",
            "offset": [
              0,
              0
            ],
            "gap": 25
          }
        },
        {
          "at": [
            0,
            -10
          ],
          "label": "0",
          "size": 0.32999999999999996,
          "fontSize": 27,
          "labelPlacement": {
            "position": "S",
            "offset": [
              0,
              0
            ],
            "gap": 25
          }
        },
        {
          "at": [
            4,
            -10
          ],
          "label": "4",
          "size": 0.32999999999999996,
          "fontSize": 27,
          "labelPlacement": {
            "position": "S",
            "offset": [
              0,
              0
            ],
            "gap": 25
          }
        },
        {
          "at": [
            8,
            -10
          ],
          "label": "8",
          "size": 0.32999999999999996,
          "fontSize": 27,
          "labelPlacement": {
            "position": "S",
            "offset": [
              0,
              0
            ],
            "gap": 25
          }
        }
      ]
    },
    {
      "id": "y-scale",
      "type": "axis",
      "from": [
        -10,
        -10
      ],
      "to": [
        -10,
        12
      ],
      "stroke": "muted",
      "strokeWidth": 1,
      "ticks": [
        {
          "at": [
            -10,
            -8
          ],
          "label": "-8",
          "size": 0.3,
          "fontSize": 27,
          "labelPlacement": {
            "position": "W",
            "offset": [
              0,
              0
            ],
            "gap": 25
          }
        },
        {
          "at": [
            -10,
            -4
          ],
          "label": "-4",
          "size": 0.3,
          "fontSize": 27,
          "labelPlacement": {
            "position": "W",
            "offset": [
              0,
              0
            ],
            "gap": 25
          }
        },
        {
          "at": [
            -10,
            0
          ],
          "label": "0",
          "size": 0.3,
          "fontSize": 27,
          "labelPlacement": {
            "position": "W",
            "offset": [
              0,
              0
            ],
            "gap": 25
          }
        },
        {
          "at": [
            -10,
            4
          ],
          "label": "4",
          "size": 0.3,
          "fontSize": 27,
          "labelPlacement": {
            "position": "W",
            "offset": [
              0,
              0
            ],
            "gap": 25
          }
        },
        {
          "at": [
            -10,
            8
          ],
          "label": "8",
          "size": 0.3,
          "fontSize": 27,
          "labelPlacement": {
            "position": "W",
            "offset": [
              0,
              0
            ],
            "gap": 25
          }
        },
        {
          "at": [
            -10,
            12
          ],
          "label": "12",
          "size": 0.3,
          "fontSize": 27,
          "labelPlacement": {
            "position": "W",
            "offset": [
              0,
              0
            ],
            "gap": 25
          }
        }
      ]
    },
    {
      "id": "x-label",
      "type": "text",
      "at": [
        12.8,
        -1.3199999999999998
      ],
      "text": "x",
      "fontSize": 27,
      "labelPlacement": {
        "position": "CENTER",
        "offset": [
          0,
          0
        ]
      }
    },
    {
      "id": "y-label",
      "type": "text",
      "at": [
        1.3,
        15.08
      ],
      "text": "y",
      "fontSize": 27,
      "labelPlacement": {
        "position": "CENTER",
        "offset": [
          0,
          0
        ]
      }
    },
    {
      "id": "p0",
      "type": "point",
      "at": [
        -1,
        2
      ],
      "label": "A",
      "fontSize": 27,
      "size": 3,
      "stroke": "ink",
      "fill": "ink"
    },
    {
      "id": "p1",
      "type": "point",
      "at": [
        5,
        3
      ],
      "label": "B",
      "fontSize": 27,
      "size": 3,
      "stroke": "ink",
      "fill": "ink"
    },
    {
      "id": "p2",
      "type": "point",
      "at": [
        0,
        -7
      ],
      "label": "C",
      "fontSize": 27,
      "size": 3,
      "stroke": "ink",
      "fill": "ink"
    },
    {
      "id": "p3",
      "type": "point",
      "at": [
        -5,
        0
      ],
      "label": "D",
      "fontSize": 27,
      "size": 3,
      "stroke": "ink",
      "fill": "ink"
    }
  ],
  "assertions": [
    {
      "id": "perp",
      "type": "perpendicular",
      "a": [
        -10,
        0
      ],
      "b": [
        10,
        0
      ],
      "c": [
        0,
        -10
      ],
      "d": [
        0,
        12
      ]
    },
    {
      "id": "grid-size",
      "type": "gridDimensions",
      "grid": "grid",
      "columns": 10,
      "rows": 11
    },
    {
      "id": "points-count",
      "type": "objectCount",
      "objectType": "point",
      "count": 4
    }
  ]
}
