{
  "schema": "ld-s10y-image/figure-spec@2",
  "id": "fig-n8-e181-first-arrows-b",
  "mode": "deterministic",
  "description": "Exact authored function graph; domain restrictions and endpoint inclusion are explicit.",
  "source": {
    "image": {
      "path": "ssot-resources/soviet10year-textbooks/artifacts/6a/figures/fig-64.png",
      "sha256": "04d35cb75b43b28257f0dba267ac7e1e4af08d5543d0d49d60d2874c39c8470e"
    },
    "authoritativeText": [
      {
        "text": "图64源图参考仅提供带网格的坐标系视觉结构；当前题所需数据由该题完整现代题面决定。"
      },
      {
        "text": "$K=\\{m,n,p,q\\}$，$M=\\{0,1\\}$。哪个箭头图表示关系 $\\{(m,0),(n,0),(p,1),(q,1)\\}$？"
      }
    ],
    "inventory": [
      {
        "id": "authored-material",
        "description": "实际查看源图64：同一格纸上两条从O出发的运动线段，A约(4,20)，B约(2,30)，横轴时间小时、纵轴路程公里。当前新增图只借坐标框架，不复刻这两条运动线或其刻度；函数、关系和单位来自各自完整题面。 新增图形全部依据当前完整题面构造；不是源图的重绘。",
        "objects": [
          "left0",
          "left0-label",
          "left1",
          "left1-label",
          "left2",
          "left2-label",
          "left3",
          "left3-label",
          "right0",
          "right0-label",
          "right1",
          "right1-label",
          "arrow0",
          "arrow1",
          "arrow2",
          "arrow3"
        ],
        "assertions": [
          "connect0",
          "connect1",
          "connect2",
          "connect3",
          "arrow-count"
        ]
      }
    ]
  },
  "canvas": {
    "width": 400,
    "height": 400,
    "boundingBox": [
      -8,
      5,
      8,
      -5
    ],
    "keepAspectRatio": false,
    "background": "paper"
  },
  "display": {
    "layout": "inline",
    "purpose": "instructional",
    "maxWidthPx": 400,
    "minTextPx": 16,
    "widths": [
      240,
      400
    ]
  },
  "objects": [
    {
      "id": "left0",
      "type": "point",
      "at": [
        -4,
        1.8
      ],
      "size": 3,
      "stroke": "ink",
      "fill": "ink"
    },
    {
      "id": "left0-label",
      "type": "text",
      "at": [
        -5.3,
        1.8
      ],
      "text": "m",
      "fontSize": 27
    },
    {
      "id": "left1",
      "type": "point",
      "at": [
        -4,
        0.6000000000000001
      ],
      "size": 3,
      "stroke": "ink",
      "fill": "ink"
    },
    {
      "id": "left1-label",
      "type": "text",
      "at": [
        -5.3,
        0.6000000000000001
      ],
      "text": "n",
      "fontSize": 27
    },
    {
      "id": "left2",
      "type": "point",
      "at": [
        -4,
        -0.5999999999999996
      ],
      "size": 3,
      "stroke": "ink",
      "fill": "ink"
    },
    {
      "id": "left2-label",
      "type": "text",
      "at": [
        -5.3,
        -0.5999999999999996
      ],
      "text": "p",
      "fontSize": 27
    },
    {
      "id": "left3",
      "type": "point",
      "at": [
        -4,
        -1.7999999999999998
      ],
      "size": 3,
      "stroke": "ink",
      "fill": "ink"
    },
    {
      "id": "left3-label",
      "type": "text",
      "at": [
        -5.3,
        -1.7999999999999998
      ],
      "text": "q",
      "fontSize": 27
    },
    {
      "id": "right0",
      "type": "point",
      "at": [
        4,
        1.8
      ],
      "size": 3,
      "stroke": "ink",
      "fill": "ink"
    },
    {
      "id": "right0-label",
      "type": "text",
      "at": [
        5.3,
        1.8
      ],
      "text": "0",
      "fontSize": 27
    },
    {
      "id": "right1",
      "type": "point",
      "at": [
        4,
        0.6000000000000001
      ],
      "size": 3,
      "stroke": "ink",
      "fill": "ink"
    },
    {
      "id": "right1-label",
      "type": "text",
      "at": [
        5.3,
        0.6000000000000001
      ],
      "text": "1",
      "fontSize": 27
    },
    {
      "id": "arrow0",
      "type": "arrow",
      "from": "left0",
      "to": "right1",
      "stroke": "ink",
      "strokeWidth": 2
    },
    {
      "id": "arrow1",
      "type": "arrow",
      "from": "left1",
      "to": "right1",
      "stroke": "ink",
      "strokeWidth": 2
    },
    {
      "id": "arrow2",
      "type": "arrow",
      "from": "left2",
      "to": "right0",
      "stroke": "ink",
      "strokeWidth": 2
    },
    {
      "id": "arrow3",
      "type": "arrow",
      "from": "left3",
      "to": "right0",
      "stroke": "ink",
      "strokeWidth": 2
    }
  ],
  "assertions": [
    {
      "id": "connect0",
      "type": "connects",
      "arrow": "arrow0",
      "from": "left0",
      "to": "right1"
    },
    {
      "id": "connect1",
      "type": "connects",
      "arrow": "arrow1",
      "from": "left1",
      "to": "right1"
    },
    {
      "id": "connect2",
      "type": "connects",
      "arrow": "arrow2",
      "from": "left2",
      "to": "right0"
    },
    {
      "id": "connect3",
      "type": "connects",
      "arrow": "arrow3",
      "from": "left3",
      "to": "right0"
    },
    {
      "id": "arrow-count",
      "type": "objectCount",
      "objectType": "arrow",
      "count": 4
    }
  ]
}
