{
  "schema": "ld-s10y-image/figure-spec@2",
  "id": "fig-50",
  "mode": "deterministic",
  "description": "Triangle, hexagon, rhombus and parallelogram in four source panels.",
  "source": {
    "image": {
      "path": "ssot-resources/soviet10year-textbooks/artifacts/5m/figures/fig-50.png",
      "sha256": "3ed8b284a2f8ca75759aa0dbd34693aa23b7ead4dde68e87676854bcdd977520"
    },
    "authoritativeText": [
      {
        "lesson": "math5-c1-s2-n11",
        "text": "假如点 $O$ 是线段 $AB$ 的中点，那么 $A$、$B$ 两点叫做关于点$O$ 的对称点（图 42）. 为了作点 $A$ 关于点 $O$ 的对称点 $B$，必须引直线 $AO$，并在直线 $AO$ 上，在点 $O$ 的另一侧作长度和 $AO$ 相等的线段 $OB$（图 43）."
      },
      {
        "lesson": "math5-c1-s2-n11",
        "text": "作图形 $F$ 和点 $O$，然后取这个图形每个点关于点 $O$ 的对称点. 结果得出一个新图形 $F_1$，它和图形 $F$ 关于点 $O$ 对称（图 44）. 点 $O$ 叫做对称中心. 任何两个成中心对称的图形都是合同的."
      },
      {
        "lesson": "math5-c1-s2-n11",
        "text": "正方形 $ABCD$（图 45）关于 $AC$、$BD$ 二线段（正方形的对角线）的交点 $O$ 对称. 点 $O$ 叫做正方形的对称中心.圆心（图 46）是圆的对称中心.机器的旋转部分（齿轮、螺旋桨、车轮、滑轮机等）一般都做成中心对称的（图 47）. 它围绕着通过对称中心的轴旋转."
      },
      {
        "lesson": "math5-c1-s2-n11",
        "text": "图 48 中，角 $AOB$ 和角 $COD$ 关于公共顶点 $O$ 对称. 这样的角叫做对顶角. 同任何关于某点对称的两个图形一样，对顶角也合同. 所以这两个角相等，也就是 $\\angle AOB=\\angle COD$. 对顶角中的一个角的两个边是另一个角的两个边的反向射线. 图 48中，射线 $OC$ 和射线 $OB$ 反向，而射线 $OD$ 和射线 $OA$ 反向."
      },
      {
        "lesson": "math5-c1-s2-n11",
        "exercise": "164",
        "text": "图 50 中哪个图形有对称中心？"
      }
    ],
    "inventory": [
      {
        "id": "hexagon-source",
        "description": "Original hexagon and all defining opposite vertices; no answer center mark added.",
        "objects": [
          "hexagon-0",
          "hexagon-1",
          "hexagon-2",
          "hexagon-3",
          "hexagon-4",
          "hexagon-5",
          "hexagon"
        ],
        "assertions": [
          "hexagon-pairs"
        ],
        "requires": [
          "pointRelationships"
        ]
      },
      {
        "id": "rhombus-source",
        "description": "Original rhombus and all defining opposite vertices; no answer center mark added.",
        "objects": [
          "rhombus-0",
          "rhombus-1",
          "rhombus-2",
          "rhombus-3",
          "rhombus"
        ],
        "assertions": [
          "rhombus-pairs"
        ],
        "requires": [
          "pointRelationships"
        ]
      },
      {
        "id": "parallelogram-source",
        "description": "Original parallelogram and all defining opposite vertices; no answer center mark added.",
        "objects": [
          "parallelogram-0",
          "parallelogram-1",
          "parallelogram-2",
          "parallelogram-3",
          "parallelogram"
        ],
        "assertions": [
          "parallelogram-pairs"
        ],
        "requires": [
          "pointRelationships"
        ]
      },
      {
        "id": "triangle-source",
        "description": "Original triangle remains without a half-turn center.",
        "objects": [
          "triangle"
        ],
        "assertions": []
      }
    ]
  },
  "canvas": {
    "width": 640,
    "height": 534,
    "boundingBox": [
      0,
      10,
      12,
      0
    ],
    "background": "paper",
    "keepAspectRatio": true
  },
  "display": {
    "layout": "scroll",
    "purpose": "instructional",
    "minTextPx": 16,
    "widths": [
      640
    ]
  },
  "objects": [
    {
      "id": "triangle",
      "type": "polygon",
      "stroke": "ink",
      "strokeWidth": 2,
      "points": [
        [
          1,
          6
        ],
        [
          4.5,
          6
        ],
        [
          2.75,
          9.2
        ]
      ],
      "fill": "accentSoft",
      "fillOpacity": 0
    },
    {
      "id": "hexagon-0",
      "type": "point",
      "stroke": "ink",
      "strokeWidth": 2,
      "at": [
        6.699999999999999,
        7.6
      ],
      "size": 0.05
    },
    {
      "id": "hexagon-1",
      "type": "point",
      "stroke": "ink",
      "strokeWidth": 2,
      "at": [
        7.699999999999999,
        9.1
      ],
      "size": 0.05
    },
    {
      "id": "hexagon-2",
      "type": "point",
      "stroke": "ink",
      "strokeWidth": 2,
      "at": [
        9.7,
        9.1
      ],
      "size": 0.05
    },
    {
      "id": "hexagon-3",
      "type": "point",
      "stroke": "ink",
      "strokeWidth": 2,
      "at": [
        10.7,
        7.6
      ],
      "size": 0.05
    },
    {
      "id": "hexagon-4",
      "type": "point",
      "stroke": "ink",
      "strokeWidth": 2,
      "at": [
        9.7,
        6.1
      ],
      "size": 0.05
    },
    {
      "id": "hexagon-5",
      "type": "point",
      "stroke": "ink",
      "strokeWidth": 2,
      "at": [
        7.699999999999999,
        6.1
      ],
      "size": 0.05
    },
    {
      "id": "hexagon",
      "type": "polygon",
      "stroke": "ink",
      "strokeWidth": 2,
      "points": [
        "hexagon-0",
        "hexagon-1",
        "hexagon-2",
        "hexagon-3",
        "hexagon-4",
        "hexagon-5"
      ],
      "fill": "accentSoft",
      "fillOpacity": 0
    },
    {
      "id": "rhombus-0",
      "type": "point",
      "stroke": "ink",
      "strokeWidth": 2,
      "at": [
        2.8,
        4.5
      ],
      "size": 0.05
    },
    {
      "id": "rhombus-1",
      "type": "point",
      "stroke": "ink",
      "strokeWidth": 2,
      "at": [
        4,
        2.5
      ],
      "size": 0.05
    },
    {
      "id": "rhombus-2",
      "type": "point",
      "stroke": "ink",
      "strokeWidth": 2,
      "at": [
        2.8,
        0.5
      ],
      "size": 0.05
    },
    {
      "id": "rhombus-3",
      "type": "point",
      "stroke": "ink",
      "strokeWidth": 2,
      "at": [
        1.5999999999999999,
        2.5
      ],
      "size": 0.05
    },
    {
      "id": "rhombus",
      "type": "polygon",
      "stroke": "ink",
      "strokeWidth": 2,
      "points": [
        "rhombus-0",
        "rhombus-1",
        "rhombus-2",
        "rhombus-3"
      ],
      "fill": "accentSoft",
      "fillOpacity": 0
    },
    {
      "id": "parallelogram-0",
      "type": "point",
      "stroke": "ink",
      "strokeWidth": 2,
      "at": [
        6.3,
        1.5
      ],
      "size": 0.05
    },
    {
      "id": "parallelogram-1",
      "type": "point",
      "stroke": "ink",
      "strokeWidth": 2,
      "at": [
        9.7,
        1.5
      ],
      "size": 0.05
    },
    {
      "id": "parallelogram-2",
      "type": "point",
      "stroke": "ink",
      "strokeWidth": 2,
      "at": [
        10.7,
        3.5
      ],
      "size": 0.05
    },
    {
      "id": "parallelogram-3",
      "type": "point",
      "stroke": "ink",
      "strokeWidth": 2,
      "at": [
        7.3,
        3.5
      ],
      "size": 0.05
    },
    {
      "id": "parallelogram",
      "type": "polygon",
      "stroke": "ink",
      "strokeWidth": 2,
      "points": [
        "parallelogram-0",
        "parallelogram-1",
        "parallelogram-2",
        "parallelogram-3"
      ],
      "fill": "accentSoft",
      "fillOpacity": 0
    }
  ],
  "assertions": [
    {
      "type": "centralSymmetry",
      "id": "hexagon-pairs",
      "center": [
        8.7,
        7.6
      ],
      "pairs": [
        {
          "a": "hexagon-0",
          "b": "hexagon-3"
        },
        {
          "a": "hexagon-1",
          "b": "hexagon-4"
        },
        {
          "a": "hexagon-2",
          "b": "hexagon-5"
        }
      ]
    },
    {
      "type": "centralSymmetry",
      "id": "rhombus-pairs",
      "center": [
        2.8,
        2.5
      ],
      "pairs": [
        {
          "a": "rhombus-0",
          "b": "rhombus-2"
        },
        {
          "a": "rhombus-1",
          "b": "rhombus-3"
        }
      ]
    },
    {
      "type": "centralSymmetry",
      "id": "parallelogram-pairs",
      "center": [
        8.5,
        2.5
      ],
      "pairs": [
        {
          "a": "parallelogram-0",
          "b": "parallelogram-2"
        },
        {
          "a": "parallelogram-1",
          "b": "parallelogram-3"
        }
      ]
    }
  ],
  "layout": {
    "minLabelGap": 2,
    "avoidRegions": []
  }
}
